"name", "basic_info", "cost_info", "avg_stars"
부산 광안리 호텔 프리마베라 in BUSAN, "이용안내체크인 시 본인 실물 신분증(사진필수)넷플릭스 NETFLIX 이용가능()넷플릭스 이용 가능넷플릭스ID가 필요하신 고객님께서는프론트로 문의 주시면 호텔직원이 로그인해드릴게요! :) 12:00~17:00클리닝점검TIME12~17시까지는 룸클리닝과 쾌적한 객실환경을 위한 2차 점검 시간입니다.얼리체크인 요청하지 않으신 경우에는, 깨끗한 청소와 정비를 위하여무리한 체크인요청은 자제 부탁드려요 :) 체크인: 17시 체크아웃: 익일12시얼리 체크인: 1시간당 10,000원레이트 체크아웃: 1시간당 10,000원 펜트하우스 스위트 파티룸: 1시간당 20,000원 얼리체크인을 요청하셔야할 경우 미리 호텔로 문의주시기바랍니다.전객실 간단 조식제공 am7:30~9:00 토스트, 씨리얼, 구운란, 쥬스, 컵라면, 약과 등 간단 조식 제공아메리칸브런치 신청:호텔 프론트로 문의주세요.광안리 고층 오션뷰 호텔 11층부터 객실 배정오션뷰를 기대하는 고객님들께서 만족할 수 있는 고층 객실!!11층부터 객실 배정이 되어, 뻥 뚫린 광안리 해수욕장을 내려다 볼수있어요! 고층 오션뷰를 원하시는 고객님들 서둘러 예약해주세요광안대교뷰 37.5도 브런치다이닝 CAFEAM 10:00~14:00까지 모닝브런치 이용권이 필요하신 고객님은프론트로 문의주세요.프리마베라 투숙객만을 위한 모닝 브런치or오믈렛 20%할인쿠폰 증정(이 외 메뉴 10%할인) 호텔 프리마베라 in BUSAN 위치 주소: 부산 수영구 광안해변로 278번길 42, A동 11층~14층호텔주변:민락 회센터 바로옆도보 1분거리광안리 해수욕장까지 약 200m 도보 2분거리수변공원까지 약 1km도보 10분거리주차최대 250대 정도 수용이 가능한 넓은 지하주차장을 원활히 이용이 가능하십니다.차량 이용 시 탐앤탐스 부산오션브릿지점을 검색하신 후 방문 해 주시면 해당 건물을 보다 편하게 찾으실 수 있습니다.지정된 체크인시간 기준부터 호텔에서 무료로 차량등록을 해드리고 있으며체크아웃 이후 출차시, 추가요금 정산이 되실 수 있는점 필히 참고 바랍니다.주차는 지하1F2F, A동B동 상관없이 하시면되고, 프론트는 A동 11층입니다.객실당 차량은 1대만 주차지원합니다. 1대의 차량이상일 경우, 주차지원이 불가하며 출차 시, 주차장에서 요금 지불 부탁드립니다.전객실 욕조,히노끼탕 주류 및 입욕제사용 불가모든 객실내 욕조, 히노끼탕은 입욕제 사용이 불가합니다.욕조 내에서 와인,맥주 등 주류를 마시거나 흘려서 색깔이염이 있는 경우 변상조취 함을 필히 알려드립니다.펜트하우스 이용안내숯불바베큐식기류취사도구 간단조리(인덕션)펜트하우스 객실에는 간단한 조리는 가능하나식기류 및 취사도구는 구비되어 있지 않으니 필요하시면 챙겨오셔야 합니다.이 점 꼭 주의바랍니다.( 침대구성: 더블더블) 거실 개별 오션테라스2인기준 1인추가시 1인당 2만원 현장추가 보조침구제공연박시 이용주의연박 이용시 룸클리닝이 필요하시면 프론트에 요청해주세요.마지막 룸클리닝 요청 시간: 18시이 후, 청소는 불가능 하오니 이점 주의바랍니다.11층 조식공간 간편조식 제공 조식 이용시간: am7:30 am9:00빵, 시리얼, 우유, 컵라면, 구운란, 주스, 다과 등기본규정 입실시 기준 인원 : 2인추가 인원시 현장에서 추가요금 결제됨을 알려드립니다.0세~24개월: 무료~6세: 10,000원7세~성인: 20,000원객실은 체크인시 배정되며, 다른 디자인의 객실로 배정될 수 있습니다.상기 이미지의 객실 예약을 원하실 경우, 프런트로 문의 부탁드립니다.성수기 및 특정일, 공휴일(전일 포함)에는 요금변동이 있을 수 있습니다.필독 객실 배정 시 객실 구조는 사진과 상이할 수 있습니다.침구 추가 시 별도의 비용이 발생합니다.전 객실 금연입니다.모든 객실은 2인 기준요금 입니다.1객실 1주차 무료 가능합니다.선착순쿠폰 EVENT [받아서 바로쓰는 인기숙소 할인 쿠폰]쿠폰획득 사용 방법예약을 원하시는 객실 상세 페이지에서 숙박 예약 터치쿠폰 목록에서 적용 가능한 쿠폰 터치쿠폰은 선착순이며, 조기마감 될 수 있습니다.숙소 소개프리마베라 (Primavera) 는 이탈리아어로 봄이라는 뜻입니다.봄의 희망과 꿈을 상징하는 이곳 !늘 바닷바람과 푸른 공기가 머무는 저희 Primavera in Busan에서 몸과 마음이 행복한 시간을 가지시길 바랍니다.", 30,000원~, 4.7
부산 광안리 그레이193, "이용안내HOTEL GRAY193만의 특별함전 객실 넷플릭스 이용가능전 객실 공기청정기 구비 완료 실내 살균 소독 및 공기 정화 매주 실시70대 동시 주차 가능전 투숙객 마스크팩 제공각층 LG 스타일러 비치최고급 요트투어 할인가 이용 가능셀프 세탁실 :: 세탁기건조기 구비 (세제 무료 제공)요트투어 안내오전 9시부터 오후 9시까지 정시 운행수영만 요트경기장~ 해운대~ 동백섬~ 마린시티~ 광안대교~ 수영만 요트경기장투어 전체 약 1시간 소요 자세한 사항은 호텔 0517104441로 문의 바랍니다 취소 공지 1일전 취소 50% 환불2일전 취소 70% 환불3일전 취소 100% 환불 (3일전 23시59분까지 취소 수수료 미발생)취소 가능일은 영업일 기준으로 산정됩니다.숙소 소개 네이버 실제후기 확인매장 청결수칙 준수 조식제공 최고의 바다 전망야놀자X그레이193 제휴로 즐겨보실 기회, 놓치지 마세요 ", 75,000원~, 4.7
부산 광안 해변 에이치에비뉴-H Avenue 광안리해변점, "이용안내조식안내H AVNEUE 광안리해변점 조식 운영안내운영 시간 07:30 ~ 9:30 am1인 이용요금 15,000원한국관광공사 인증 2성급 호텔한국관광공사 인증 2성급 관광호텔 에비뉴 광안리해변전 객실 금연 객실로 운영 중입니다. 조식 스타벅스원두커피 샴페인 세트제공 이벤트 상시 진행 중(상단 현장 이벤트 참고 바랍니다 이벤트가 너무 많아요)한국관광공사 인증 2성급 호텔2019년 완공된 최신 설비 동급 한식, 양식을 동시에 즐기는 조식 뷔페 서비스매일 새옷처럼 전고객 LG스타일러 무료이용오션뷰 라운지 전고객 이용가능(숙소테마 참고)당신의 행운을 시험하세요 럭키박스 이벤트 수시진행미세먼지 저리가랏!! 전 객실 큐브 공기청정기 배치5성급 최고급 구스 침구최고급 벨기에산 라텍스에어컨(냉난방가능)LG 49인치 LED TV(VOD시청 가능)냉장고(생수 무료제공)커피포트샤워시설욕실용품(칫솔, 치약, 면도기, 쉐이빙 젤, 스킨, 로션, 바디워시, 바디로션, 샴푸, 컨디셔너, 빗, 솜, 면봉 )드라이기가운MW 호텔 침구 및 어메니티무료 WIFI무료주차가능객실 금연, 별도 흡역 구역 있음수화물보관(24시)노트북 대여넷플릭스 시청가능(프론트 문의)[제휴 할인]레스토랑카페한국관광공사 인증 2성급 호텔월요일~일요일, 체크인 16:00 이후, 체크아웃 12:00 이전부모 동반 아동 투숙 가능 (6세 이하 무료)인원 추가 시 1인당 20,000원 (침구제공) 별도 발생조식 1인 15,000원 별도 발생, 조식 이용 시간 7:30~9:30얼리 체크인, 레이트 체크아웃, 조식 이벤트 상시 진행 중 (현장 이벤트 참고 해주세요)미성년자는 보호자와 동반시 투숙이 가능하며, 미성년자 예약으로 인해 발생하는 입실거부에 대해서는 취소나 환불이 불가합니다.미성년자의 예약 결제 및 서비스 이용은 불가합니다.(부모님 동의 시 가능)실시간 예약의 특성 상 동일한 객실에 중복 예약이 발생할 수 있으며, 이 경우 먼저 결제 완료된 예약 건에 우선권이 있으므로 이후 중복 예약건은 취소될 수 있습니다.미확정 성수기 요금 혹은 오등록 요금으로 예약 결제하신 경우, 해당 내용 안내 및 예약 건의 취소가 진행될 수 있습니다.한국관광공사 인증 2성급 호텔입실 6일 전 17시까지, 취소수수료 없음입실 5일 전 17시까지, 취소수수료 10%입실 4일 전 17시까지, 취소수수료 20%입실 3일 전 17시까지, 취소수수료 30%입실 2일 전 17시까지, 취소수수료 50%입실 1일 전 17시까지, 취소수수료 80%당일 취소 및 NoShow, 입실시간 경과실제 입실 후, 환불불가취소수수료는 판매금액을 기준으로 계산됩니다.노쇼의 경우, 결제한 전체금액(쿠폰포인트 포함)은 환불되지 않습니다.노쇼(NOSHOW) : 사전 연락없이 예약된 숙소를 이용하지 않음을 의미특별 이벤트하나. 2인 조식 뷔페 스벅원두 커피 무제한 제공둘. 주니어 스위트 이상급 객실 한정, 레이트 체크아웃 13시셋. 스파트윈에비뉴 객실 이상 샴페인미니바 OR 러쉬 입욕제 버블바쓰 상품 중 택1 단 럭키박스는 2인조식스벅원두 커피 이벤트만 제공됩니다. 이코노미 스탠다드 객실은 모든 이벤트 내용 불포함입니다.투숙객 혜택체크인 전후 짐보관 가능전 객실 공용 에어드레서 이용가능스타벅스 원두 커피 머신 무료 이용 가능야경이 아름다운 테라스 라운지 새벽 1시까지 무료 이용 가능유료 수화물 운송서비스 가능 호텔부산역 (짐캐리 홈페이지 참조)숙소 소개H Avenue 광안리해변점은 5성급 호텔의 서비스를 느낄 수 있습니다.광안대교 및 광안리 해수욕장을 한눈에 볼 수 있는 H Avenue 광안리해변점. 이곳은 끝없이 찰랑거리는 파도를 바라보며 뷰멍을 즐기걸로 유명해요.특히 저녁에는 도보 1분 거리에 위치해 있는 회센터에서 포장한 다음 객실에서 바다를 바라보며 음미하기에 딱 좋죠. 또 투숙객에게 제공되는 조식은 광안리 해변을 바라보며 기분좋게 즐길 수 있으니 진정한 뷰맛집으로 손색없답니다.더불어 이곳은 5성급 호텔에서 느끼는 쾌적감 또한 만끽할 수 있는데요. 전 객실에 공기청정기부터 벨기에산 천연 라텍스, 푹신한 구스 침구 사용으로 머무는 순간까지 기분 좋은 미소를 머금을 수 있어요.에디터 TIP1. 로비에 스타일러 위치(무료사용가능)2. 레이트체크아웃13:00 가능(객실별 상이) 에이치에비뉴 광안리 해변점은 전 객실 금연객실로 운영하고 있습니다. ", 125,000원~, 4.8
부산 광안리 브라운도트 광안리해수욕장점, "이용안내객실 예약요금 공지사항객실 예약요금은 2인 기준 요금입니다.기준인원(2인) 이상 추가인원 입실시 현장에서 1박당 15,000원 비용이 발생됩니다.객실 이용 공지사항7~8월 해수욕장 이용 고객님은 대실 이용이 불가합니다.애견동반 입실이 불가합니다.주차관련 공지사항12시 이후 출차시에는 주차장에서 별도의 추가 주차비가 발생합니다.객실당 주차 차량은 1대 기본입니다.(차량이 2대일 경우 추가비용발생)야놀자 회원혜택성수기 및 특정일, 공휴일(전일 포함)에는 요금 변동이 있을 수 있습니다.미성년자 이용이 제한됩니다.입실 시에 신분증 확인하오니 양해 부탁드립니다.오시는 길 주소부산 수영구 남천바다로33번길 31 브라운도트 호텔 광안리해수욕장점주변안내광안리해수욕장까지 40m(도보 1분 거리)금련산역까지 348m(도보 6분 거리)광안역까지 894m(도보 14분 거리)민락회센터까지 1.2km(도보 18분 거리)민락포장마차까지 1.5km(도보 23분 거리)민락공원까지 1.8km(도보 28분 거리)남천역까지 895m(도보 14분 거리)숙소 소개브라운도트 광안리 해수욕장점브라운도트 호텔은 익숙하지만 일상에서 벗어나 감성을 자극할 수 있는 도심 속 부티크 공간으로, 취향에 상관없이 누구나 호감을 가질만한, 대중적이면서 개성있는 호텔입니다.브라운도트 광안리 해수욕장점이 선보일 최고의 서비스와 다양한 혜택을 놓치지 마세요~", 25,000원~, 4.5
부산 광안리 보나트리호텔, "이용안내기본규정각 객실의 입실 기준을 확인바라며, 추가 인원시 현장에서 추가요금 결제됨을 알려드립니다.성수기 및 특정일, 공휴일(전일 포함)에는 요금 변동이 있을 수 있습니다.환불 및 취소는 규정에 따라 상이하게 처리될 수 있습니다.Late check in event room 은 연박불가합니다.(연박원할시 문의바랍니다)입실 시 신분증을 확인하고 미성년자는 입실이 제한됩니다(신분증을 꼭 지참해주시기 바랍니다.)불편사항 있을 시 언제든지 안내실에 문의주세요. 친절하게 답변해드리겠습니다~!취소 및 환불 규정7월, 8월 성수기 기간(특정일) 취소불가(사유에 따라 80~90% 수수료 발생할 수 있습니다.)체크인일 기준 7일 전 : 70% 환불체크인일 기준 6일 전 : 50% 환불체크인일 기준 5일 전 : 40% 환불체크인일 기준 4일 전 : 30% 환불체크인일 기준 3일 전 : 30% 환불체크인일 기준 1일 전~당일 및 Noshow : 환불불가주차 정보도보특가외 상품은 예약당 주차1대 이며 추가 주차원하실 문의 및 추가요금발생됩니다.흡연 정보전 객실 금연객실이며 흡여구역은 주차장 입구쪽에 있습니다", 35,000원~, 4.8
부산 광안리 광안 Stay Hotel, "이용안내2021년 6월17일 올리모델링 정식오픈전 객실 넷플릭스 무료시청가능전 객실 라텍스메모리폼 5성급호텔 매트리스 설치완료전 객실 5성급 새 침구류와 새 린넨 제공전 객실 LG 퓨리케어 공기청정기 설치완료스낵바에서 최고급 스타벅스 원두커피제공전 객실 65인치 스마트TV 설치전 객실 넷플릭스웨이브더빙왓챠유튜브 스마트TV로 이용가능VR빠른입실 VR늦은퇴실 상품에 VR은 선착순제공이며 소진시 제공이불가파티룸 노래방 이용 가능시간은 23시입니다.객실별제원스탠다드객실16.5m2디럭스더블19.8m2디럭스트윈19.8m2슈페리어더블19.8m2파티룸60m2기본 규정VR별도대여는 일일1대당 15,000원입니다.객실내 취사행위는 환불없이 즉각 퇴실입니다.15시이후 퇴실시 일박요금청구디자인호텔 특성 상 동일한 타입이나 객실 내부디자인이나 구조가 상이할 수 있습니다.전 객실 금연 (건물 내에 한함)객실 당 1대 주차가능 (도보특가 제외)모든객실은 2인기준입니다.인원추가 요금 : 25개월 미만 인원 추가시 객실당 1명 면제 25개월 이상 1인당 2만원침구추가 1인추가시 추가당 무료제공(별도추가시 10,000원)마지막체크인가능시간 체크아웃일자 02시입니다 이후 노쇼처리레이트체크아웃시 시간당 1만파티룸 시간당2만세탁서비스(유료)세탁건조세제제공유료10,000원광안스테이호텔에서는 추가비용과숙소내의 기물파손,분실등에 대비해서 체크인시 투숙보증용 실물카드번호or보증금5만원을 받고 체크아웃시에객실점검후 카드번호삭제및보증금반환을 해드리고 있습니다.VR,고데기,충전기대여는 프런트에신분증맡기고 대여가능빠른 입실을 원하시면 문의바랍니다.빠른 입실을 원하시면 문의바랍니다.주차 안내 숙박,대실 고객님에 한해 1실1주차가능합니다.(도보상품제외)호텔내부 주차장 만차시 외부주차장으로 안내드릴 수 있습니다. (호텔과 10m,무료주차가능)환불 규정 안내예약 취소에 따른 환불규정은 광안 Stay Hotel내규에 따라 적용됩니다.광안스테이에서는 미성년자 혼숙을 절대 허용치않습니다 미성년자혼숙예약시 환불은 절대 불가하며 신분증제출거부시 입실이 불가하며 환불불가합니다. 코로나로인한 거리두기단계에따른 객실인원제한은 소비자께서 부산시청이나 질병관리청에 문의하시어 예약을 하셔야하며 이에따른 환불요청은 숙소에선 받아들여지지않으니신중한예약을 당부드립니다.광안스테이는 체크인을 위해서 입실등록카드를 작성받고 있습니다 등록카드에는 성함 연락처 인원수기재와주의사항에대해 공지하고 서명을 받고있으며등록카드작성거부시에는 호텔에서는 입실거부를 할 수 있으며위의 사유로는 환불이 불가하오니 이점 꼭 양지해주시길 부탁드립니다.주변시설 안내민락회센터까지 도보 2분 거리수변공원까지 도보 10분 거리광안리 해수욕장까지 도보 2분거리센텀시티까지 차량 3분 거리용궁사까지 차량 23분 거리동부산아울렛까지 차량 20분 거리신세계백화점 센텀시티점까지 차로 6분거리아동입실1명까지 가능숙소 소개 2021년 6월 리모델링 완료 VR서비스 이용가능 전 객실 공기청정기 및 스마트TV설치5성급 라텍스 침구류 제공최상의 컨디션을 STAY HOTEL 에서 누리세요.", 50,000원~, 4.7
부산 광안리 호텔 라움103, "이용안내예약안내전 객실 기준인원 외 1인당 1.5만원 추가됩니다이용안내 기준 인원 외 추가 인원은 프론트로 문의바랍니다.주차 안내 숙소 바로 앞 수변공원 공영주차장(주차면 102면), 만차시 인근 수변 어린이공원 공영주차장(주차면수 102면), (거리 330미터) 전 객실 금연입니다. 반려동물동반불가 숙소입니다야놀자 회원혜택성수기 및 특정일, 공휴일에는 요금변동이 있을 수 있습니다.킹사이즈 라텍스 침대 보유오리깃털 이불 사용으로 포근함 제공침대헤드 등받이 각도 조절 가능전 객실 어메니티 구비고데기 폰 충전기 와인 잔 구비(프론트 문의)주변안내수변공원까지 30m, 도보 1분 거리광안리해수욕장까지 500m, 도보 7분 거리벡스코까지 2.65km. 차량 10분 거리신세계 백화점까지 2.67km, 차량 9분 거리영화의전당까지 2.71km, 차량 10분거리해운대 해수욕장까지 3.98km, 차량 14분 거리숙소 소개광안리 최고의 광안대교뷰 보유 호텔해수욕장 인근에 위치한 광안리 호텔 라움103호텔 라움103에서 편하고 즐거운 시간을", 60,000원~, 4.8
부산 광안리 광안비치호텔 더 엠(THE M), "이용안내광안리해수욕장 도보 거리 45초5성급호텔식 살균탈취 시행광안리해수욕장 도보 거리 45초트윈 객실과 마레 파티 하우스 객실의 기준인원수는차이가 있음을 양지바랍니다모든 객실의 입실 기준 인원은 2명이며 객실 요금 또한 2인 기준입니다.객실 디자인이 많아 사진과 상이할 수 있습니다성수기 및 특정일, 공휴일(전일 포함)에는 요금 변동이 있을 수 있습니다.환불 및 취소는 규정에 따라 상이하게 처리될 수 있습니다.입실 시 신분증을 확인하고 2004년 생을 포함한 미성년자는 입실이 제한됩니다(신분증을 꼭 지참해주시기 바랍니다.)불편사항 있을 시 언제든지 안내실에 문의주세요.친절하게 답변해드리겠습니다", 25,000원~, 4.9
부산 수영 봄날, "이용안내이용안내환불규정 당일시. 취소 처리 안됨 연박 예약건은 입실일자부터는 중간에 취소 불가체크인시간은 새벽02:00까지입니다. 새벽02:00~오전 09:00까지 카운터콜 안받습니다. 성수기 및 특정일, 공휴일(전일 포함)에는 요금 변동이 있을 수 있습니다.미성년자 예약시 입실거부및 취소불가입니다 (민증검사는 필수입니다)저희숙소는 컴퓨터랑tv연결 안됩니다.전객실 pc안됩니다 (리모델링이후가능)객실 이용시 파손물품에 대해 객실 이용자 변상을 원칙으로 하며 구입가격을 변상합니다객실기준인원 초과시 추가비용 부담(인당 1만원입니다.패밀리룸포함) 2인이상인 경우 카운터에 체크하고입실해주세요(노체크및 몰래 들어가는경우 강제퇴실및 환불불가입니다)지나친 소음이나소란,고성,음주로 인한 행패시 다른 손님들의 편안한 휴식을위해강제퇴실되며 이로인한 환불이 불가능합니다퇴실시간 경과이후 자동연장 대실비용으로 처리됩니다 (콜해드리지않습니다)조식은 당분간 안합니다 리모델링이후 가능합니다야놀자 회원혜택성수기 및 특정일, 공휴일(전일 포함)에는 요금 변동이 있을 수 있습니다.야놀자 회원혜택은 현금 결제 시 적용됩니다.17:00시 이후대실예약건 입실시 이용시간 3시간입니다.숙소 소개봄처럼 따뜻하고~ 포근한 숙소봄날에 오신것을 환영합니다!지하철 수영역 팔도시장 초근접숙소 주변 수영 맛집핫플 인근위치", 45,000원~, 4.6
부산 광안리 호텔 런더너, "이용안내현장결제 이벤트현장결제 하시는 분들께숙박결제금액 현금 10%, 카드5% 상당의 호텔런더너 금액권을 드립니다.이벤트 참여 원하시는 분은 프론트에 문의주세요.(편의점, 라운지 이용,추가 주차 요금,추가 인원 요금 지불 등 런더너 내에서 다양하게 사용하실 수 있습니다.)편의점 운영호텔 안에서 모든걸 해결하자!로비에서 각종 과자와 음료수,맥주를 판매합니다.세스코 특별관리로 방역안심매장 인증세스코의 바이러스케어 집중관리와 열화상 카메라 설치, 엘레베이터 내 향균 필름 부착, 객실 청소 시 방역소독기 의무사용으로 코로나19 방역에 최선을 다하고 있습니다호텔의 기본, 최고급 거위털 침구 사용여독을 풀고 편안하고 안락하게 묵고 가실 수 있도록, 전 객실 특급호텔 수준의 최고급 거위털 침구류를 사용합니다. 야놀자 회원혜택성수기 및 특정일, 공휴일(전일 포함)에는 요금 변동이 있을 수 있습니다.저희 호텔은 전 객실 금연입니다흡연시 별도의 청소비가 부과되오니 양해부탁드립니다. 전화예약 환불규정 안내체크인 7일 전: 전액 환불체크인 3~6일 전: 50% 환불체크인 1~2일전: 10% 환불체크인 당일: 환불 불가추가금안내전객실 2인 기준이며 추가 인원 1인당 15,000원씩 추가금이 발생합니다.11시퇴실이며 퇴실시간 연장 시 시간당 10,000원씩 추가금이 발생합니다.1실 1주차이며 추가 시 1대당 10,000원 추가금이 발생합니다. ", 30,000원~, 4.7
