"name", "basic_info", "cost_info", "avg_stars"
부산 광안리 하운드 광안리, "이용안내확인 사항안녕하세요 광안하운드호텔 입니다.호텔 운영상 23시~08시 까지 프론트 서비스가 제한적이게 되어 요청사항은 23시 전 부탁드리겠습니다.편안한 숙박을 위한 청결에는 최선을 다 할 것이며,고객님들의 너그러운 양해 부탁드리겠습니다. 감사합니다.투숙객 혜택전 객실 OTT 시청 가능 유튜브, 넷플릭스 (개인계정)로비 무료 커피 제공부산 하운드 광안리세련되고 감각적인 인테리어로 조화를 이룬 하운드 광안리는 부티크라는 컨셉에 어울리는 공간의 시각과 도심속의 힐링으로 기분좋은 시간을 유도합니다.최고의 시설로 사랑받는,부산 하운드 광안리아름다운 광안리를 담고 있는 부산 광안리 하운드에서 아름다운 추억을 만드세요!!부대시설 안내주차 타워 (무료 주차)장소 : 1층 입구 옆 이용 가능 시간 : 24시간 상시 가능루프탑 테라스이용 시간: 24시간 상시 Open장소: 10층 9층 엘레베이터 옆 계단을 통해 입장제한 사항 : 외부 음식 반입 불가이용시간 및 예약문의 안내체크인 시간 및 체크아웃 시간 예약 및 문의사항은 프런트로 전화 부탁드립니다.예약 후 체크인 시 , 프론트에서 성함을 말씀 하시면 됩니다.야놀자 회원 안내성수기 요금 안내특정일,공휴일,성수기는 요금변동이 있을수 있습니다.광안 하운드 호텔 이용 공지사항체크인 시간 및 체크아웃 시간일 목요일 체크인 15:00 이후, 체크아웃 11:00 이전금,토, 공휴일 전날 체크인 16:00 이후, 체크아웃 11:00이전( 7~8월은 성수기 기간으로 시간연장이 불가합니다.)특히, 여름 성수기 및 기타 연휴 기간들에는 호텔 사정상 빠른 입실 또는 늦은 퇴실 서비스가 불가하오니, 미리 양해 바랍니다.호텔 이용 규제 및 추가요금 안내 미성년자는 보호자와 동반시 투숙이 가능하며, 미성년자 예약으로 인해 발생하는 입실거부에 대해서는 취소 및 환불 불가 체크인시 신분증 확인이 있을 수 있습니다. 부모동반 아동 투숙 가능 (4세 이하 무료) 인원 추가비용 1인 20,000원 별도발생(5세이상)5세 이하 2인 20,000원) 모든 추가 요금은 현장결제체크인시배정 하프오션뷰 안내체크인시배정 하프오션뷰 객실은 사진과 다른 객실로 배정받으실 수 있습니다.해당 타입은 당 호텔 앞에 건물이 있어 광안대교, 바다와 앞건물이 같이 보이는 객실입니다. 해당 사항 꼭 미리 확인 부탁드립니다.객실 내 비품 항목칫솔,치약, 비누, 생수,헤어드라이기, 커피포트,수건, 슬리퍼, 가운 등객실 내 제한 사항 객실 내 흡연 (벌금 30만원) 애완동물 출입금지 배달음식 이용금지 객실 내 큰 소음 발생 금지 성냥, 양초, 라이터, 등 인화성 물질 사용 금지 벽지 및 유리에 이벤트 관련 물품들 부착 금지호텔 내 불가능 서비스 환전 서비스 세탁 서비스 룸 서비스 픽업 및 센딩 서비스 귀중품 보관 서비스 국제 전화 서비스호텔 내 가능 서비스 분실물 및 습득물 택배 서비스 (착불택배) 24시간 짐 보관 서비스 짐캐리 서비스 관광 안내 서비스 간단한 프린트(출력물) 서비스 흑백만 가능 , 출력물이 많을 경우 요금이 발생 할 수 있음. 콜택시 서비스주변안내광안리 해변 언양불고기 골목에 있습니다광안리해수욕장까지 140m, 도보로 1분 거리입니다. 금련산역까지 297m, 도보로 5분 거리입니다. 광안역까지 917m, 도보로 14분 거리입니다. 민락공원까지 1.6km, 도보로 23분 거리입니다. 광안대교까지 1.5km, 도보로 23분 차량으로 5분 거리입니다.숙소 소개하운드 광안리점은 오션뷰 반신욕을 즐길 수 있습니다.감각적인 인테리어로 일상의 답답함에 숨을 트여주는 하운드 광안리점은 광안리해수욕장과 도보로 단 1분 거리에 위치해 있어요. 낮에도 밤에도 언제든지 코 앞에서 바다를 즐길 수 있죠. 객실 안에서도 오션뷰를 만끽할 수 있는데요. 오션뷰 객실 중 디럭스 더블의 경우 광안리 해수욕장과 마주하며 반식욕을 즐길 수 있어 인기가 많답니다.", 60,000원~, 4.9
부산 광안리 J, "이용안내주차 문의특실 객실 주차 가능일반실, 1인실 (도보특가) 주차 불가차량방문 시 미리 문의 부탁드립니다.야놀자 회원혜택성수기 및 특정일, 공휴일(전일 포함)에는 요금변동이 있을 수 있습니다이용안내2인실은 2인기준, 1인실은 1인기준 가격입니다. 추가인원있을 경우 사전문의 바랍니다. (추가요금있음)특실의 경우만 주차가능합니다.애완동물은 입실 불가합니다.주변안내광안역 2번출구 바로 앞 , 부산은행 광안지점 바로옆광안리해수욕장까지 도보 7~8분거리민락회센터까지 약 1.2km, 차량 4분거리부산 MBC까지 약 1.6km, 차량 5분거리수영교차로까지 약 1.5km, 차량 5분거리해운대 센텀시티역 지하철 3구역 7분거리경성대 부경대 지하철 지하철 3구역 7분거리벡스코에서 지하철4구간, 차량이용시 8분거리숙소 소개부산 광안리 J에서 만나는 특별한 하루!도심 속 특별한 휴식을 지금 바로 이 곳에서 경험하세요~!", 20,000원~, 4.3
부산 광안리 더클럽호텔 (구, 더베이 클럽), "이용안내확인 사항더 베이 클럽호텔에서 부산 광안리 더클럽호텔 (구, 더베이 클럽) 으로 상호명 변경되었습니다.상호에 부엉이 마크를 확인해주세요!이름은 바뀌어도 저희 직원은 바뀌지 않습니다!더욱더 친절하고 깨끗하게!!고객님의 안전하고 행복한 휴가를 만들어 드릴 수 있도록 최선의 노력을 다하겠습니다!!더클럽호텔 변함없는 사랑과 관심 부탁드립니다.오션뷰가 보이는 테라스20평대 광안리에서 가장 넓고 안락한 펜션형 호텔오션뷰가 보이는 테라스에서 프라이빗한 시간을 보내세요.광안리 바닷가가 한눈에 보이는 부산 최고의 VIEW광안리 최초 가족, 연인, 남녀노소 즐길수 있는 오션뷰 전망으로 무료온수가 제공되는 히노끼탕과 야외테라스객실 내 취사 가능(인덕션, 전기밥솥, 전자레인지, 정수기, 커피포트, 대형냉장고,식기세트,와인잔,공기청정기 구비)비즈니스 고객 및 출장고객을 위한 스타일러,개인금고 구비(프런트로 문의 주세요)헤어스타일러기(고데기) 프론트에 준비되어 있습니다. 오션뷰 펜션형 객실광안리 더클럽호텔만의 오션뷰 테라스에서 특별한 하루를 보내세요.추가인원 안내사항전객실 기준인원은 2인이며 , 기준인원이상입실시 입실전 미리 연락부탁드립니다.사전연락없이 기준인원 이상 입실시 입실이 거부되실수 있으니 미리 연락 부탁드립니다.기준인원 추가시 1인당(만 4세 이상) 2만원의 추가요금이 발생하며, 침구류 제공 됩니다.AOA객실은 최대인원이 2인 입니다.최대인원초과시 입실이 취소되실수 있습니다.전객실 반려견동반입실은 절대 불가하며, 적발시 환불없이 퇴실조치됩니다.자세한 내용은 호텔에 문의주시면 친절하게 안내해드리겠습니다.공지사항체크인 시 본인 실물 신분증(사진필수) 확인을 진행합니다.체크아웃시간을 반드시 지켜주세요.체크아웃시간은 오전 11시 입니다.객실내의 지정된 화기류 외에는 반입및 사용이 금지되어 있습니다.적발시 경고없이 퇴실조치 되오니 양해부탁드립니다.성수기 및 특정일, 공휴일에는 요금변동이 있을 수 있습니다입실시 퇴실시간 약속과 사용하신 물품, 야외테라스 사용에 관한 약속으로반환보증금 5만원 있습니다.퇴실시에 반환해 드려요. 야외히노끼탕 무료온수 이용안내늦은시간 입실시 입실 2시간전 연락주시면 저희가 따뜻한 온수를 받아 준비해드리겠습니다(온수온도유지가 가능합니다)24시간 무료로 따뜻한 온수 사용이 가능하세요.히노끼탕 특성상 세신과 입욕제, 오일제품의 사용이 엄격히 금지되어있습니다.(위반사항으로 인한 피해부분은 고객님께서 부담하셔야 함을 알려드립니다.) 객실내 침구류및 집기류 매일 소독코로나19 확산방지와 고객님의 쾌적하고 건강한 여행을 위하여 객실 청소후 침규류및 집기류에 알콜소독을 매일매일 진행하고 있습니다.프론트에 별도의 알콜소독제가 비치되어 있으니 필요하신 고객님은 프론트에 문의해 주세요. 세스코 멤버스 가입 호텔세스코 멤버스 서비스를 통해 전객실및 호텔에 정기적인 방역관리로 위생적이고 쾌적한 호텔 관리에 최선을 다하고 있습니다.엄마에겐 힐링을 아이들에게는 즐거움을엄마에겐 힐링을 아이들에게는 즐거움을 선사하는 프라이빗 공간(키즈풀로도 사용 가능)코로나19로 인해 공공장소 이용을 꺼려 하시는 부모님들께서는 프라이빗한 저희 더베이 클럽 호텔을 찾아주세요.잊지못할 즐거운 순간을 제공해 드리겠습니다. 24시간 무료 온수 제공고객님의 필요시 언제든 온수공급이 가능합니다.(온수온도 직접조절 가능)야외히노끼탕과 족욕탕에서 따뜻한 온수로 일상에서 지친 몸과 마음을 힐링하세요 특정일 예약안내특정일(불꽃축제,크리스마스, 연휴기간) 예약은 호텔로 문의해 주시면 상세히 안내해 드리겠습니다.문의전화 : 0517611369 010 8625 1369인스타그램 : thebayclubhotelpusan취소 및 환불규정저희 호텔은 고객님의 만족을 위해 최상의 컨디션을 제공하고자 최선을 다해 운영하고 있습니다.따라서 예약 취소의 경우 객실 공급에 어려움이 있는 호텔 특성상 입실 3일전 까지만 취소가 가능하오니 양해 부탁드립니다.위치안내광안리 해수욕장에서 189m, 도보 1분거리민락 회센타에서 294m. 도보 1분거리광안역 2호선에서 1.4km, 차량 6분 거리민락수변공원에서 686m, 도보 10분거리신세계백화점 센텀시티점에서 2.9km, 차량 12분거리해운대 해수욕장에서 4.6km,차량 14분거리애완견애완묘 동반 입실 불가애완견애완묘 동반 입실 불가숙소 소개아름다운 오션뷰와 히노끼탕, 감각적인 인테리어로 HOT한 광안리 더베이 클럽호텔", 990,000원~, 4.8
부산 광안리 오션스테이, "이용안내공지사항쾌적한 투숙을 위해 모든 객실은 금연 객실로 운영되고 있습니다.매일 아침 7시 30분부터 9시까지 5층 조식당에 간단한 식사가 준비됩니다.휴대폰 충전기, 헤어 기기, 와인잔은 프론트에서 대여할 수 있습니다.객실 호수 및 디자인은 호텔 운영 상황에 따라 랜덤 배정됩니다.객실 물건 파손 및 도난 시 형사 처벌 받을 수 있습니다.미성년자 예약으로 인해 발생하는 입실 거부에 대해 취소나 환불이 불가합니다.성수기 및 특정일, 공휴일 (전일 포함)에는 요금 변동이 있을 수 있습니다.셀프세탁방 OPENSELFLAUNDRY OPEN7층에서 세탁기, 건조기 이용 가능! (세제 무료 제공)요트투어 안내오션스테이 전 숙박객 1인 2만 5천원에 요트투어 가능! (원가 1인 5만원)수영만요트경기장 해운대 마린시티 동백섬 (누리마루) 광안대교 광안리해수욕장투어 소요시간은 약 1시간이며 승선은 10시~21시에 이뤄집니다.전화 문의를 통해 원하는 날짜, 시간대에 승선 가능합니다. 자세한 문의는 호텔로 연락 바랍니다.숙소 소개WELCOME TO OCEANSTAY HOTEL광안리에서 시작하는 설렘 가득한 하루, 놓치지 마세요!", 30,000원~, 4.9
부산 광안리 부띠크 호텔 휴, "이용안내 2022.06.27 리모델링 OPEN전 객실 사진 준비중 (이전의 사진 사용 중)입니다.빠른시일 내에 정확한 사진으로 찾아뵙겠습니다.기본규정각 객실의 입실 기준을 확인바라며, 추가 인원시 현장에서 추가요금 결제됨을 알려드립니다.성수기 및 특정일, 공휴일(전일 포함)에는 요금 변동이 있을 수 있습니다.환불 및 취소는 규정에 따라 상이하게 처리될 수 있습니다.입실 시 신분증을 확인하고 미성년자는 입실이 제한됩니다(신분증을 꼭 지참해주시기 바랍니다.)불편사항 있을 시 언제든지 안내실에 문의주세요. 친절하게 답변해드리겠습니다~!선착순 쿠폰 대량 배포중 [받아서 바로쓰는 인기숙소 할인 쿠폰]() 쿠폰획득 사용 방법 예약을 원하시는 객실 상세 페이지에서 숙박 예약 터치쿠폰 목록에서 적용 가능한 쿠폰 터치쿠폰은 선착순이며, 조기마감 될 수 있습니다.숙소 소개) 부띠크 호텔 휴와 함께 행복한 광안리 나들이()항상 행복한 추억만 선물하겠습니다.", 30,000원~, 4.6
부산 수영 블루밍, "입실아동입실 불가금연전 객실 금연", 30,000원~, 4.0
부산 광안리 궁, "이용안내전 객실 금연룸으로 운영하고있습니다.흡연은 지정된 흡연 장소에서 부탁드립니다. 자세한 사항은 프론트로 문의 부탁드립니다.이용안내Event Room 완비로멘틱 이벤트 가능프런트로 문의바람객실안내 101, 102, 601, 301, 501호는 단체룸301, 501호는 온돌방특실은 2 입실 가능하며 , 1인 추가시 1만원(평일) 1만 5천원(금,토) 추가비용으로 이용가능야놀자 회원혜택성수기 및 특정일, 공휴일(전일 포함)에는 요금 변동이 있을 수 있습니다.이벤트주중(일목) 숙박고객님께 영화무료관람권 객실당 1매씩 드립니다.", 50,000원~, 4.4
부산 광안리 W, "이용안내기본규정각 객실의 입실 기준을 확인바라며, 추가 인원시 현장에서 추가요금 결제됨을 알려드립니다.성수기 및 특정일, 공휴일(전일 포함)에는 요금 변동이 있을 수 있습니다.환불 및 취소는 규정에 따라 상이하게 처리될 수 있습니다.입실 시 신분증을 확인하고 미성년자는 입실이 제한됩니다(신분증을 꼭 지참해주시기 바랍니다.)불편사항 있을 시 언제든지 안내실에 문의주세요. 친절하게 답변해드리겠습니다~!선착순 쿠폰 대량 배포중 [받아서 바로쓰는 인기숙소 할인 쿠폰]() 쿠폰획득 사용 방법 예약을 원하시는 객실 상세 페이지에서 숙박 예약 터치쿠폰 목록에서 적용 가능한 쿠폰 터치쿠폰은 선착순이며, 조기마감 될 수 있습니다.주차 정보주차장 주소 : 등대주차장부산광역시 수영구 남천바다로33번길 109부산광역시 수영구 광안동 1951위 주소로 네비게이션 찍고 방문해주세요!숙소 소개안녕하세요. 부산 광안리 w 호텔 지배인입니다.저희 호텔은 한국 고유 감성 한옥 스타일을 추구하는 감성 호텔로2022년 05월 리모델링 오픈하였습니다.해수욕장 바로 앞에 위치하여, 드론축제광안대교 야경 등 광안리의 멋진 풍경을 품고 있으며최상의 어메니티와 최고의 컨디션 유지를 위해 노력하고 있습니다.고객님들의 선택에 최고로 보답하기위해 최선을 다 하겠습니다.감사힙니다.", 35,000원~, 4.7
부산 광안리 비엔나, "숙소 소개광안리 해수욕장 도보로 5분 거리수변공원 도보로 5분 거리", 20,000원~, 4.3
부산 광안리 유토피아관광호텔, "숙소 소개 ", 47,000원~, 3.6
부산 광안리 HY리얼티 호텔, "이용안내확인 사항차량 혼잡으로 인하여 금토요일은 입실시 주차 가능 상품 예약 고객님은 1회에 한해서 호텔 주차장 또는 제휴업체 주차장 주차 보장을 해드리니 이점 양해바랍니다.객실별 포함사항중 숙박 핫딜 및 일반 룸타입 대실은 포함사항 적용이 안되며 숙박은 일반 숙박 상품대실은 호캉스 페키지 상품만 포함됩니다.프론트 운영 시간: am 10:00 ~ pm 24:00오더 요청시간: am10:00~pm 24:00배정된 객실과 사진은 상의할 수 있습니다.인원추가 및 시간추가로 인하여 발생되는 금액 또한 객실별로 상의하며금액은(10.000원 ~ 15.000원) 발생됩니다.야놀자 회원혜택미성년자 입실 가능 여부는 직접 제휴점에 확인 후 예약하세요.미성년자 및 가족이 아닌 혼숙(남1여2 , 여1남2) 예약으로 인해 발생하는 입실거부에 대해서는 취소환불 불가합니다.당일예약은 해당객실이 마감되므로, 어떤 사유가 있던 취소,환불처리가 불가합니다.예약손님 입실시간 안내숙박 예약 후 연락이나 구두상 통보 없이 익일 am2:00까지 입실 하지 않는 경우 자동 퇴실 처리 됨을 알려드립니다.가맹점 사정에 의해 객실 정보가 수시로 변경 될 수 있습니다.이로 인한 불이익은 당사가 책임을 지지 않습니다.성수기 및 특정일, 공휴일(전일 포함)에는 요금 변동이 있을 수 있습니다.애완동물 동반은 불가합니다.모든 객실 타입은 랜덤으로 배정 됩니다.룸 지정이 필요하신 분은 호텔로 문의 바랍니다.필독 어플예약시 공지사항모든 객실은 랜덤 배정되오니 양지 하시길 바랍니다.성수기 특정일 공휴일에는 입실시간과 대실요금은 달라질수 있으니, 프론트로 문의바랍니다친절하게 안내해 드립니다.항상 노력하는 더 그랑 호텔이 되겠습니다. 감사합니다!Business Center출장 고객님 특별우대 합니다. 많은 성원 부탁드립니다.비즈니스코너에서는 고객 여러분의 성공적인 비즈니스를 위한 효율적이고 세심한 서비스를 제공해드립니다.복사(컬러, 흑백), 팩스 송수신, 인터넷, 스캔 서비스객실사용 안내(동반인원 및 체크아웃시간)객실 이용요금은 모든객실 동일 2인 입실 기준 입니다.고객님의 퇴실시간 오전11시 이며 이후의 퇴실시 1시간에 1만원의 추가요금이 발생됩니다.전객실 금연 객실입니다.주차관련 공지사항건물주차장 만차일 경우 외부주차장 마린랜드주차장(정마트, 신협건물 지하) 이용 부탁드립니다.객실당 1대까지 주차 가능하며, 차량 추가 주차시 1대당 1만원의 주차비가 발생합니다.숙소 소개2021년 12월 리뉴얼 오픈 혜택 BIG 31.호텔식 인테리어와 5성급 호텔 침구와 비품 구비2.철저한 방역소독(박테사이드 소독 진행)", 20,000원~, 4.6
부산 광안리 썬시티, "이용안내주차장 안내 (신호 주차장)부산 광안리 썬시티 호텔 맞은편 마포숯불갈비 옆 골목 신호 주차장기본규정각 객실의 입실 기준을 확인바라며, 추가 인원시 현장에서 추가요금 결제됨을 알려드립니다.성수기 및 특정일, 공휴일(전일 포함)에는 요금 변동이 있을 수 있습니다.환불 및 취소는 규정에 따라 상이하게 처리될 수 있습니다.입실 시 신분증을 확인하고 미성년자는 입실이 제한됩니다(신분증을 꼭 지참해주시기 바랍니다.)불편사항 있을 시 언제든지 안내실에 문의주세요. 친절하게 답변해드리겠습니다~!숙소 소개 바닷가 바로 앞, 진짜 가까운 광안리해수욕장주차장부산 광안리 썬시티 호텔 맞은편 마포숯불갈비 옆 골목 신호 주차장", 30,000원~, 4.1
부산 수영 메종드센텀, "이용안내확인 사항Maison de Centum Hotel전 객실 금연 입니다.객실 내부나 화장실에서 흡연 시 청소 비용 부과되며근처 객실에서 흡연 행위에 대한 항의로 인하여 적발 될 시환불 없이 바로 퇴실 조치 되십니다.메종 드 센텀을 찾아주시는 모든 손님들께서 편안히머물다 가시기 위한 호텔 규정입니다미성년자는 이용이 제한되어 입실 시에 신분증을 확인하오니 양해 부탁 드립니다.부모님 동반 아닌 이상 미성년자 분들은 절대 입실 불가기준 인원 초과 시 1인 2만원 발생합니다.최대 인원 외에 절대 입실 불가.(환불불가)유아 동반 시 미리 연락 주세요.남,여가 섞여서 3인 이상은 이용 불가합니다.풍선이벤트하시는경우 (벽지,커튼에 테이프붙이면안됩니다.)객실 내 음식 반입 시 벽지 손상에 주의해 주세요.과도한 손상 시 배상 책임은 고객 님에게 있습니다.무한대실이용시간은 최대시간입니다. 마감시간에 따라 이용시간제한Maison de Centum HotelMZ세대 Needs를 반영한 컨텐츠 호텔입니다.5성급 고이고이 침구가운65UHD SMART TV넷플릭스 무료 시청가능웨이브 온 무료 시청가능Disney 시청가능(개인아이디)YOUTUBE 시청가능메종 드 센텀 호텔에서 추억쌓기전 객실 넷플릭스 시청 가능전 객실 무료 WIFI 사용 가능무인 시스템(키오스크)으로 편리하게 입실 가능하며 자동 결제 시스템 구축2층 비대면 셀프존 운영일회용 숟가락,젓가락, 렌즈통(리뉴액), 위생용품, 비품등아이폰 충전기, C타입 충전기 객실내 완비프론트 대여품목 : 휴대폰 충전기, 고데기안락한 휴식을 위한 최고급 어메니티가 제공됩니다.입실 시에 신분증 확인 하오니 양해 부탁 드립니다. ( 신분증 지참 )성수기,특정일,공휴일은 요금 변동이 있을 수 있습니다.외출 시 카드 키 반납 부탁 드립니다. 분실 시 3만원 청구주차 정보탑차, 튜닝카, 차체가 낮은 차량의 경우 주차장 진입이 불가 하오니 프론트(0517574415)로 문의 주시면 친절히 답변 드리겠습니다.메종 드 센텀 호텔 환불 규정안내.7일 전 : 10% 공제 후 환불5일 전 : 30% 공제 후 환불3일 전 : 50% 공제 후 환불2일 전 : 80% 공제 후 환불1일 전 및 당일 : 환불불가Maison de Centum 연박 이용 Maison de Centum 연박 이용 시 공지사항 연박 이용 시 평일에는 별도 추가 요금 없습니다. 다만 공휴일 전, 금요일, 토요일, 일요일 연박 이용 시 추가 요금이 발생 되오니확인 부탁 드립니다. 따로 생성한 예약에 대한 유선 혹은 현장 연박 처리 요청 시 이 점 반영이 어려우실 수 있으며, 연박으로 이용을 원하시는 경우에는 예약 처음 생성 시 연박으로 예약을 부탁 드립니다. 체크인 시 따로 생성한 예약에 대한 연박 처리 요청이 불가한 사항으로 인한 환불요청은 승인이 어렵습니다. 연박 이용 시 지정 시간 청소 요청은 불가 합니다. 룸클리닝서비스 : 연박 시 룸클리닝서비스(객실청소)를 무료로 제공해드리며 오후 4시 오후 6시 사이에 진행됩니다.숙소 소개메종 드 센텀 호텔은 원래 낡고 오래된 모텔이었습니다.저희는 모텔을 매입하고, 깔끔한 인테리어, 다양한 컨텐츠, 더 나은 휴식을 위한아이템들을 더해 새로운 형태의 콘텐츠 호텔로 만들어 가고 있습니다.객실에서는 영화, 플레이스테이션, 음악 등 10종 이상의 컨텐츠를 경험할 수 있고,2층에는 잠시 쉬어갈 수 있는, 간편 조리가 가능한 캔틴 공간을 마련해놨습니다.또 전문적인 교육을 받은 직원이 체계 잡힌 응대 서비스를 제공하고,여러분이 머무는 공간의 청결 상태를 책임집니다.메종 드 센텀 호텔의 모든 객실에서 OTT 서비스, 크리에이터들의 작품이 담긴 액자,더 나은 휴식을 위해 아늑호텔이 직접 개발한 고이고이 침구류와 어메니티를경험해 보실 수 있습니다.. 지원 OTT 서비스 : 넷플릭스 디즈니플러스 유튜브", 30,000원~, 4.9
부산 수영 S, "이용안내기본규정입실시 기준 인원은 2인이며, 추가 인원시 현장에서 추가요금 결제됨을 알려드립니다.객실은 체크인시 배정되며, 상기 이미지와 다를 수 있습니다. 상기 이미지의 객실 예약을 원하실 경우, 프런트로 문의 부탁드립니다성수기 및 특정일, 공휴일(전일 포함)에는 요금변동이 있을 수 있습니다.", 25,000원~, 3.7
부산 광안리 씨티, "입실아동입실 불가금연전 객실 금연", 40,000원~, 4.3
부산 광안리 휴, "이용안내기본규정각 객실의 입실 기준을 확인바라며, 추가 인원시 현장에서 추가요금 결제됨을 알려드립니다.성수기 및 특정일, 공휴일(전일 포함)에는 요금 변동이 있을 수 있습니다.환불 및 취소는 규정에 따라 상이하게 처리될 수 있습니다.입실 시 신분증을 확인하고 미성년자는 입실이 제한됩니다(신분증을 꼭 지참해주시기 바랍니다.)불편사항 있을 시 언제든지 안내실에 문의주세요. 친절하게 답변해드리겠습니다~!", 50,000원~, 3.3
